{
  "$schema": "http://json-schema.org/draft-07/schema#",
  "$id": "https://game-intel.local/schema/character-card.schema.json",
  "title": "game-intel character guide card",
  "type": "object",
  "required": [
    "id",
    "name",
    "game"
  ],
  "additionalProperties": true,
  "allOf": [
    {
      "if": {
        "not": {
          "required": ["stub"],
          "properties": {
            "stub": { "const": true }
          }
        }
      },
      "then": {
        "required": ["sources", "as_of"],
        "properties": {
          "sources": {
            "minItems": 1,
            "items": {
              "type": "string",
              "minLength": 8
            }
          },
          "as_of": {
            "type": "string",
            "minLength": 4,
            "description": "Asia/Shanghai date or month the card was verified, e.g. 2026-09"
          }
        }
      },
      "description": "Non-stub cards (stub absent or false) must cite sources and as_of."
    }
  ],
  "properties": {
    "id": {
      "type": "string",
      "minLength": 1
    },
    "name": {
      "type": "string",
      "description": "Canonical display name (usually ZH)"
    },
    "name_zh": {
      "type": "string"
    },
    "name_en": {
      "type": [
        "string",
        "null"
      ]
    },
    "aliases": {
      "type": "array",
      "items": {
        "type": "string"
      }
    },
    "nicknames": {
      "type": "array",
      "items": {
        "type": "string"
      }
    },
    "game": {
      "type": "string"
    },
    "role": {
      "type": [
        "string",
        "null"
      ]
    },
    "skills": {
      "type": "array",
      "items": {
        "type": "object",
        "required": [
          "name"
        ],
        "additionalProperties": true,
        "properties": {
          "name": {
            "type": "string"
          },
          "type": {
            "type": "string"
          },
          "summary": {
            "type": "string"
          }
        }
      }
    },
    "skill_prio": {
      "type": "array",
      "description": "Cited 加点 / 练度 lines. Empty when the source does not state an order or level.",
      "items": {
        "type": "string"
      }
    },
    "stigmata": {
      "type": [
        "object",
        "null"
      ],
      "additionalProperties": true
    },
    "weapon": {
      "type": [
        "string",
        "null"
      ]
    },
    "teams": {
      "type": [
        "object",
        "null"
      ],
      "additionalProperties": true,
      "description": "Short cited 配队 notes. HW dopamine_auto is A/B/C from the auto roster. HW mode cells story, rift_45, dopamine, spec_ops, union, training are √ or × from the GameKee 适用场合表. comp is an array of verbatim sentences. A BD2 costume name key is that costume's 测评 line. Empty object when no sentence was published."
    },
    "sources": {
      "type": "array",
      "minItems": 1,
      "items": {
        "type": "string",
        "minLength": 8
      },
      "description": "Verified source URLs (GameKee / Prydwen / Bahamut). Required when stub is not true."
    },
    "stub": {
      "type": "boolean",
      "description": "true = placeholder; do not invent skills"
    },
    "note": {
      "type": "string"
    },
    "as_of": {
      "type": "string",
      "minLength": 4,
      "description": "Required on non-stub cards. Asia/Shanghai date or month."
    },
    "verified": {
      "type": "string"
    },
    "gamekee_content_id": {
      "type": [
        "integer",
        "string",
        "null"
      ]
    },
    "gamekee_entry_id": {
      "type": [
        "integer",
        "string",
        "null"
      ]
    },
    "portrait": {
      "type": [
        "string",
        "null"
      ],
      "description": "Public https portrait for hw, nikke, and bd2. null when no cited image loaded. GameKee entry icons are cdnimg-v2.gamekee.com; a Nikke card with no icon may use a cdn.prydwen.gg image that appears on a Prydwen page already in sources."
    },
    "portrait_source": {
      "type": [
        "string",
        "null"
      ],
      "description": "URL the portrait was read from. GameKee cards cite /v1/entry/list. Prydwen fallbacks cite that character page. null when portrait is null."
    },
    "portrait_via": {
      "type": [
        "string",
        "null"
      ],
      "description": "Which field supplied the URL, e.g. gamekee-entry-icon:hw:163036 or prydwen-character:biscuit. null when portrait is null."
    },
    "summary": {
      "type": "object",
      "description": "Human+AI conclusion line. Required on non-stub HW/NIKKE/BD2 cards at export. summary.stub true = thin evidence (no invented tier/pull). Omit on skill stubs.",
      "additionalProperties": true,
      "required": ["sources"],
      "properties": {
        "tier": {
          "type": "string",
          "description": "Verified strength line, e.g. GameKee T度. Do not invent."
        },
        "position": {
          "type": "string",
          "description": "Catalog class/element/rarity when no verified tier exists."
        },
        "pull": {
          "type": "string",
          "description": "Pull advice copied from a cited source. No invented numbers."
        },
        "skip": {
          "type": "string",
          "description": "What not to chase, only when a source says so."
        },
        "caveat": {
          "type": "string",
          "description": "Honest limit of the conclusion (missing tier list, no pull text)."
        },
        "stub": {
          "type": "boolean",
          "description": "true = conclusion incomplete; do not treat tier/pull as verified."
        },
        "sources": {
          "type": "array",
          "minItems": 1,
          "items": {
            "type": "string",
            "minLength": 8
          },
          "description": "Verified source URLs for the conclusion bar"
        }
      }
    },
    "sinner": {
      "type": "object",
      "description": "Limbus Company: the sinner this Identity card belongs to. Game and follow pages group by sinner.id. Other games omit it.",
      "additionalProperties": true,
      "properties": {
        "id": { "type": "string" },
        "name_en": { "type": "string" },
        "name_zh": { "type": "string" },
        "order": { "type": "integer" },
        "source": { "type": "string" }
      }
    },
    "sin_affinities": {
      "type": "array",
      "description": "Limbus Company sin resource counts copied from the identity page. Do not invent a count.",
      "items": {
        "type": "object",
        "required": ["sin"],
        "additionalProperties": true,
        "properties": {
          "sin": { "type": "string" },
          "count": { "type": "integer" }
        }
      }
    }
  }
}
