{
  "id": "yan_yu",
  "name": "妍雨",
  "name_zh": "妍雨",
  "name_en": null,
  "aliases": [],
  "nicknames": [],
  "game": "hw",
  "role": "T1 / 输出 / 爆发 / 贪食使徒",
  "skills": [
    {
      "name": "贪食的权能",
      "type": "active",
      "summary": "造成魔法攻击力33%的打击伤害，并恢复相当于自身最大生命值5.5%的生命值。"
    },
    {
      "name": "点心时间",
      "type": "passive",
      "summary": "当成为生命恢复效果的目标时，若【贪食】效果尚未达到最大叠层（最多8层），则会触发【进食时刻】：拿出食物来吃。随机获得1层或2层【贪食】效果。该技能被视为基本技能。"
    },
    {
      "name": "跳起攻击",
      "type": "active",
      "summary": "高高跃起后，朝指定位置着陆并发动攻击。 对3m圆形范围内的敌人造成魔法攻击力110%的打击伤害。"
    },
    {
      "name": "因为吃得很饱！",
      "type": "passive",
      "summary": "战斗中获得的生命值恢复量增加11%。在成为生命值恢复效果之目标的回合，或使用了战斗技能的回合结束时，获得1层【潜在卡路里】效果"
    },
    {
      "name": "吃完再走",
      "type": "active",
      "summary": "恢复相当于已失去生命值33%的生命值，并获得4层【贪食】效果。使用「贪食的化身」技能后，该技能会变更为「哐哐砸地！！」，并重置冷却时间。两个技能共用冷却时间。"
    },
    {
      "name": "贪食的化身",
      "type": "active",
      "summary": "仅当【贪食】效果达8层以上时才可使用，会以失去护盾+消耗32%生命值为代价，在获得强力强化效果的同时，将该技能变更为「嘴里发射光束!!」。在2轮后，除了「嘴里发射光束!!」技能以外，所有其他技能都将无法使用。 嘴里发射光束!! 对前方扇形范围造成魔法攻击力121%的打击伤害，当体质数值超过18时，暴击伤害增加。"
    }
  ],
  "skill_prio": [
    "主要爆发来源于大招，主加大招。可惜由于技能削弱其他输出技能也得点一下。",
    "贪食的权能: 不加",
    "点心时间: 不加",
    "跳起攻击: 6级即可",
    "因为吃得很饱！: 6级即可",
    "吃完再走: 6级即可",
    "贪食的化身: 尽量点满"
  ],
  "stigmata": {
    "set_id": null,
    "set_name": "生命连结",
    "pieces": 4,
    "notes": [
      "2件: 战斗中最大生命值",
      "4件: 全攻击力增加、斩击/打击强化",
      "新的生命连结套可以说是量身定制，提升很大。词条选择最大生命，暴击伤害和行动恢复力均可。"
    ]
  },
  "weapon": "怎么吃都吃不完的汉堡",
  "teams": {
    "comp": [
      "有专武贝拉或布莉辛配合打多巴胺不错"
    ]
  },
  "sources": [
    "https://www.gamekee.com/hw/670432.html"
  ],
  "stub": false,
  "as_of": "2026-09-30",
  "gamekee_content_id": 670432,
  "gamekee_entry_id": 191188,
  "portrait": "https://cdnimg-v2.gamekee.com/wiki2.0/images/w_1000/h_1300/50448/725147/2025/8/17/799028.png",
  "portrait_source": "https://www.gamekee.com/v1/entry/list?page_no=1&limit=2000",
  "portrait_via": "gamekee-entry-icon:hw:191188",
  "verified": "GameKee hw/670432 图鉴",
  "note": "抽取建议: 被削弱角色，就算强度还行也不建议多抽。EX0+1专武即可。被大幅削弱后一回合只有一次爆发，但是身板自拐可以，有专武贝拉或布莉辛配合打多巴胺不错。特种只能打优势环境，不太值。",
  "summary": {
    "sources": [
      "https://www.gamekee.com/hw/670432.html"
    ],
    "tier": "T1 / 输出 / 爆发 / 贪食使徒",
    "pull": "被削弱角色，就算强度还行也不建议多抽。EX0+1专武即可。被大幅削弱后一回合只有一次爆发，但是身板自拐可以，有专武贝拉或布莉辛配合打多巴胺不错。特种只能打优势环境，不太值。",
    "stub": false,
    "caveat": "抽取建议摘自卡面已收录备注，未另编数字。"
  }
}
