{
  "id": "pretina",
  "name": "普拉蒂娜",
  "name_zh": "普拉蒂娜",
  "name_en": null,
  "aliases": [],
  "nicknames": [
    "白金"
  ],
  "game": "hw",
  "role": "T2 / 聚怪 / 坦克 / 白金君主",
  "skills": [
    {
      "name": "盾击",
      "type": "active",
      "summary": "命中目标时，对敌人造成近战攻击力60%的斩击伤害，并以20%的机率赋予【眩晕】状态。此技能在【展开盾牌】状态下将转化为「剑击」技能。"
    },
    {
      "name": "剑之歌",
      "type": "active",
      "summary": "对半径2.5m圆形范围内所有敌人造成近战攻击力90%的斩击伤害，并进入【展开盾牌】状态，获得【重力集中】效果。"
    },
    {
      "name": "重力坠落",
      "type": "active",
      "summary": "仅在拥有【重力集中】效果时，消耗此效果后可发动此技能。对周围6公尺内的敌人造成近战攻击力80%的打击伤害，并将其拉近5公尺。"
    },
    {
      "name": "白金之心",
      "type": "passive",
      "summary": "若未处于【展开盾牌】状态，则在自身回合开始时获得【白金之心态】效果。若在【展开盾牌】状态下受到攻击，则获得【白金之气息】效果。"
    }
  ],
  "skill_prio": [
    "没有上场价值，不需要加。",
    "盾击: 不加",
    "剑之歌: 不加",
    "重力坠落: 不加",
    "白金之心: 不加"
  ],
  "stigmata": {
    "set_id": null,
    "set_name": "罪孽清算",
    "pieces": 4,
    "notes": [
      "2件: 战斗中行动恢复力",
      "4件: 获得行动力、敌人抗性降低",
      "低配尼姆塞，拿一套罪孽开怪就行。"
    ]
  },
  "weapon": "第一颗心脏",
  "teams": {
    "dopamine_auto": "B"
  },
  "sources": [
    "https://www.gamekee.com/hw/634336.html"
  ],
  "stub": false,
  "as_of": "2026-09-28",
  "gamekee_content_id": 634336,
  "gamekee_entry_id": 163030,
  "verified": "GameKee hw/634336 图鉴",
  "note": "抽取建议: 建议无视。常驻池里的地雷。由于仇恨值系统改动，本身不好拉仇恨，聚怪也有好的多的选择，一无是处的EX，半神化后作为坦克位依然不如尼姆赛和马克西米莉亚。",
  "summary": {
    "sources": [
      "https://www.gamekee.com/hw/634336.html"
    ],
    "tier": "T2 / 聚怪 / 坦克 / 白金君主",
    "pull": "建议无视。常驻池里的地雷。由于仇恨值系统改动，本身不好拉仇恨，聚怪也有好的多的选择，一无是处的EX，半神化后作为坦克位依然不如尼姆赛和马克西米莉亚。",
    "stub": false,
    "caveat": "抽取建议摘自卡面已收录备注，未另编数字。"
  }
}
