{
  "id": "yi_fu_li_te",
  "name": "伊芙利特",
  "name_zh": "伊芙利特",
  "name_en": null,
  "aliases": [],
  "nicknames": [],
  "game": "hw",
  "role": "T1 / 回AP / 援攻 / 极焰大精灵",
  "skills": [
    {
      "name": "奥术爆炸",
      "type": "active",
      "summary": "对圆形范围内的敌人造成魔法攻击力30%的无形伤害，并造成魔法攻击力30%的追加打击伤害。"
    },
    {
      "name": "奥术洗礼",
      "type": "passive",
      "summary": "轮次开始时，会对奥术精灵外的我方赋予【奥术洗礼】效果。当【奥术洗礼】效果消失时，战场内的奥术精灵将获得1层【纯粹能量】效果。"
    },
    {
      "name": "灰烬漩涡",
      "type": "active",
      "summary": "对指定目标造成魔法攻击力75%的火焰伤害，并对范围内周围目标造成魔法攻击力30%的扩散火焰伤害，同时将敌人拉向中心。"
    },
    {
      "name": "烈焰规律",
      "type": "passive",
      "summary": "对被战斗技能命中的敌人赋予持续2轮的火焰防御下降效果。 当持有【奥术洗礼】效果的我方在自己回合进行攻击时，会以一定机率触发「灰烬漩涡」技能进行支援攻击"
    },
    {
      "name": "极炎风暴",
      "type": "active",
      "summary": "消耗2层【纯粹能量】才能使用此技能。对圆形范围内敌人造成魔法攻击力140%的火焰伤害，并将其拉向范围中央。对持有【火种契约者】效果的我方赋予相当于自身基础行动恢复力45%的行动力。"
    },
    {
      "name": "火焰契约",
      "type": "active",
      "summary": "当生命值在80%以上时可使用此技能。消耗自身基础最大生命值30%与目前生命值50%链接一个我方单位，生成会随自身移动的领域，并赋予链接我方【火种契约者】效果，【火种契约者】在领域内行动消耗的行动力会被返还一部份。"
    }
  ],
  "skill_prio": [
    "全部价值都在火焰契约上。支援攻击也可以稍微点一下。",
    "奥术爆炸: 不加",
    "奥术洗礼: 不加",
    "灰烬漩涡: 6级即可",
    "烈焰规律: 不加",
    "极炎风暴: 不加",
    "火焰契约: 尽量点满"
  ],
  "stigmata": {
    "set_id": null,
    "set_name": "罪孽清算",
    "pieces": 4,
    "notes": [
      "2件: 战斗中行动恢复力",
      "4件: 获得行动力、敌人抗性降低",
      "作为辅助带罪孽套提速，开局给主C上链子即可。"
    ]
  },
  "weapon": "布尔卡努斯",
  "teams": {},
  "sources": [
    "https://www.gamekee.com/hw/666802.html"
  ],
  "stub": false,
  "as_of": "2026-09-28",
  "gamekee_content_id": 666802,
  "gamekee_entry_id": 189425,
  "verified": "GameKee hw/666802 图鉴",
  "note": "抽取建议: EX0+1专即可。洛伊丝半神化后可以0cost出场，配合她+格里泽尔达组成新时代火塞队能刷行动力，因此价值大幅提升。",
  "summary": {
    "sources": [
      "https://www.gamekee.com/hw/666802.html"
    ],
    "tier": "T1 / 回AP / 援攻 / 极焰大精灵",
    "pull": "EX0+1专即可。洛伊丝半神化后可以0cost出场，配合她+格里泽尔达组成新时代火塞队能刷行动力，因此价值大幅提升。",
    "stub": false,
    "caveat": "抽取建议摘自卡面已收录备注，未另编数字。"
  }
}
