{
  "id": "liu_yuan_lu_yi_si",
  "name": "柳原路易斯",
  "name_zh": "柳原路易斯",
  "name_en": null,
  "aliases": [
    "柳原路易丝"
  ],
  "nicknames": [],
  "game": "asora",
  "role": null,
  "skills": [],
  "skill_prio": [],
  "teams": {},
  "sources": [
    "https://www.gamekee.com/www/722620.html"
  ],
  "stub": true,
  "note": "TGS「悠露子三人组」之一，私立利萨拉女学园（正文写作丽莎拉女学园）特殊社团。摘要：问题少女，出身贵族，却被家族视为耻辱。正文亦写作柳原路易丝，称天赋和实力都不够，看不得别人轻视他人。页面称三人被官方描述成「一群乌合之众组成的社团」。不写技能、强度或概率。",
  "as_of": "2026-09-30",
  "verified": "GameKee www/722620 TGS 悠露子三人组"
}
