{
  "id": "shiraishi_kotoha",
  "name": "白石琴叶",
  "name_zh": "白石琴叶",
  "name_en": null,
  "aliases": [],
  "nicknames": [
    "冰女"
  ],
  "game": "hw",
  "role": "T0.5 / 增伤 / 一人成军",
  "skills": [
    {
      "name": "迎击",
      "type": "active",
      "summary": "造成魔法攻击力60%的无形伤害"
    },
    {
      "name": "狐狸的步伐",
      "type": "passive",
      "summary": "战斗开始时获得30行动力，并于首次自身回合结束前，移动力增加55%。"
    },
    {
      "name": "生命奉纳",
      "type": "active",
      "summary": "消耗自身生命值，永久获得能力值提升。消耗自身目前生命值的63%，使魔法攻击力增加40%。此技能在战斗中仅可使用一次。"
    },
    {
      "name": "浑然一体之术",
      "type": "active",
      "summary": "使用[生命奉纳]技能后才能使用。 赋予指定我方[浑然一体]效果：近战、魔法攻击力增加相当于目标基础近战、魔法攻击力的110%。施法者每有50魔法攻击力，最终增加量增加2.5%。最终增加量最多可以增加至100%。此效果持续期间，效果施法者将无法进行任何应对及行动，并免疫[嘲讽]、[眩晕]等状态异常效果。 效果持有者死亡或透过[境界保护]技能获得的护盾消失时，[浑然一体]效果将消失。"
    },
    {
      "name": "境界保护",
      "type": "passive",
      "summary": "使用[浑然一体之术]技能时，会根据失去生命值的40%为自身生成护盾。当此护盾消失，或持有[浑然一体]效果的我方死亡时，获得120行动力。透过[境界保护]效果所获得的护盾存在期间，自身不会死亡;受到超出护盾值的伤害，仅限1次不会减少生命值。"
    }
  ],
  "skill_prio": [
    "大招升级后除了本身外还能提升专武的专属技能效果，因此最优先，其次是卖血。其他6级即可。",
    "迎击: 不加",
    "狐狸的步伐: 6级即可",
    "生命奉纳: 6级即可",
    "浑然一体之术: 尽量点满",
    "境界保护: 6级即可"
  ],
  "stigmata": {
    "set_id": null,
    "set_name": "罪孽清算",
    "pieces": 4,
    "notes": [
      "2件: 战斗中行动恢复力",
      "4件: 获得行动力、敌人抗性降低",
      "行动力再多也就只能开1次附身，因此只需要堆魔攻提高buff量就行。选罪孽套主要是先手开buff。"
    ]
  },
  "weapon": "护符：狐神的引导",
  "teams": {
    "dopamine_auto": "C"
  },
  "sources": [
    "https://www.gamekee.com/hw/716690.html"
  ],
  "stub": false,
  "as_of": "2026-09-28",
  "gamekee_content_id": 716690,
  "gamekee_entry_id": 221006,
  "verified": "GameKee hw/716690 图鉴",
  "note": "抽取建议: 单体增伤辅，但是机制很容易断档，容错率低。综合EX0+1就行了。",
  "summary": {
    "sources": [
      "https://www.gamekee.com/hw/716690.html"
    ],
    "tier": "T0.5 / 增伤 / 一人成军",
    "pull": "单体增伤辅，但是机制很容易断档，容错率低。综合EX0+1就行了。",
    "stub": false,
    "caveat": "抽取建议摘自卡面已收录备注，未另编数字。"
  }
}
