{
  "id": "yan_cai_ying",
  "name": "妍彩英",
  "name_zh": "妍彩英",
  "name_en": null,
  "aliases": [],
  "nicknames": [],
  "game": "hw",
  "role": "T1.5 / 隐秘之眼",
  "skills": [
    {
      "name": "手枪射击",
      "type": "active",
      "summary": "造成射击攻击力60%的穿刺伤害"
    },
    {
      "name": "隐匿",
      "type": "passive",
      "summary": "攻击敌人的弱点后使用光学迷彩隐藏自己。每轮1次，弱点攻击时以20%的机率获得【隐蔽:隐身】效果。目前失去的生命值比例每减少1%，触发机率增加1%。"
    },
    {
      "name": "暗杀",
      "type": "active",
      "summary": "造成射击攻击力100%的穿刺伤害。此攻击必被判定为从敌人后方攻击，无视敌人反击效果"
    },
    {
      "name": "全员处刑",
      "type": "active",
      "summary": "向最多3名敌人连续射击按近距离顺序进行分散攻击，以射击攻180%根据攻击目标数量造成穿刺伤害"
    },
    {
      "name": "无法回避之眼",
      "type": "passive",
      "summary": "所有友军命中增加30%"
    }
  ],
  "skill_prio": [
    "输出全在普攻上，所以点普攻就行。",
    "手枪射击: 尽量点满",
    "隐匿: 不加",
    "暗杀: 不加",
    "全员处刑: 不加",
    "无法回避之眼: 不加"
  ],
  "stigmata": {
    "set_id": null,
    "set_name": "亡灵宴会",
    "pieces": 4,
    "notes": [
      "2件: 战斗中暴击伤害",
      "4件: 技能伤害、潜行下所有攻击力",
      "新的套装对于能隐身的射击C完爆了四骑士套，无脑选就行。词条暴击率射击暴伤都行，不过暴击率能转化暴伤所以尽量堆暴击率就行。"
    ]
  },
  "weapon": "DMP-9 原型",
  "teams": {},
  "sources": [
    "https://www.gamekee.com/hw/634272.html"
  ],
  "stub": false,
  "as_of": "2026-09-28",
  "gamekee_content_id": 634272,
  "gamekee_entry_id": 163027,
  "portrait": "https://cdnimg-v2.gamekee.com/wiki2.0/images/w_1000/h_1300/50448/236746/2025/2/10/435312.png",
  "portrait_source": "https://www.gamekee.com/v1/entry/list?page_no=1&limit=2000",
  "portrait_via": "gamekee-entry-icon:hw:163027",
  "verified": "GameKee hw/634272 图鉴",
  "note": "抽取建议: 拿1个专武就行。本体突破的话毕竟是S角色，有就拿也没问题。和红秘书苏珠熙不同，定位是射击C，不过射击C同赛道竞争激烈，不算好用。",
  "summary": {
    "sources": [
      "https://www.gamekee.com/hw/634272.html"
    ],
    "tier": "T1.5 / 隐秘之眼",
    "pull": "拿1个专武就行。本体突破的话毕竟是S角色，有就拿也没问题。和红秘书苏珠熙不同，定位是射击C，不过射击C同赛道竞争激烈，不算好用。",
    "stub": false,
    "caveat": "抽取建议摘自卡面已收录备注，未另编数字。"
  }
}
