{
  "id": "qian_long",
  "name": "千隆",
  "name_zh": "千隆",
  "name_en": null,
  "aliases": [],
  "nicknames": [],
  "game": "hw",
  "role": "T1.5 / 坦克 / 反击 / 格里克君主",
  "skills": [
    {
      "name": "兄弟会的一击",
      "type": "active",
      "summary": "对扇形范围内的敌人造成近战攻击力60%的斩击伤害。"
    },
    {
      "name": "千手姿态",
      "type": "active",
      "summary": "举起双手剑并采取反击姿势。直到下轮自己的回合开始前，处于[反击态势]状态，暴击率提升30%，无论基本反击次数如何，都将反击。"
    },
    {
      "name": "挑衅咆哮",
      "type": "active",
      "summary": "对半径5公尺圆形范围内的敌人造成魔法攻击力30%的打击伤害。对被命中的敌人施加2轮【挑衅】效果，使其所有攻击力减少20%，并在2轮内增加自身的仇恨修正。此攻击时，命中率暂时增加300%。"
    },
    {
      "name": "皇冠切割",
      "type": "active",
      "summary": "对敌人造成相当于近战攻击力100%的斩击伤害。使用此技能时，该回合内根据自身失去的生命值，斩击强化最多增加至200%。使用此技能击杀敌人时，将恢复相当于最大生命值40%的生命。"
    }
  ],
  "skill_prio": [
    "加了点也没输出，点个咆哮嘲讽一下差不多了。",
    "兄弟会的一击: 不加",
    "千手姿态: 不加",
    "挑衅咆哮: 6级即可",
    "皇冠切割: 不加"
  ],
  "stigmata": null,
  "weapon": "亚隆拜特",
  "teams": {},
  "sources": [
    "https://www.gamekee.com/hw/634300.html"
  ],
  "stub": false,
  "as_of": "2026-09-28",
  "gamekee_content_id": 634300,
  "gamekee_entry_id": 163028,
  "verified": "GameKee hw/634300 图鉴",
  "note": "抽取建议: 抽1个专武就行。即使有专武提供输出加成的情况下本身输出依然不足，一般接近于奥丝拉的下位。配合尤洁妮亚可以打出不错的效果。",
  "summary": {
    "sources": [
      "https://www.gamekee.com/hw/634300.html"
    ],
    "tier": "T1.5 / 坦克 / 反击 / 格里克君主",
    "pull": "抽1个专武就行。即使有专武提供输出加成的情况下本身输出依然不足，一般接近于奥丝拉的下位。配合尤洁妮亚可以打出不错的效果。",
    "stub": false,
    "caveat": "抽取建议摘自卡面已收录备注，未另编数字。"
  }
}
