{
  "id": "mi_la",
  "name": "米拉",
  "name_zh": "米拉",
  "name_en": null,
  "aliases": [],
  "nicknames": [],
  "game": "hw",
  "role": "T1 / 坦克 / 聚怪 / 一人成军",
  "skills": [
    {
      "name": "誓约一击",
      "type": "active",
      "summary": "造成近战攻击力40%的斩击伤害。每持有1层[誓约光辉]，造成魔法攻击力3.1%的追加无形伤害。"
    },
    {
      "name": "主从连结",
      "type": "passive",
      "summary": "每轮当[连结的主君]效果持有者首次攻击时，根据所消耗的行动力获得对应的[曙光]层数：每轮开始时，转换为持续1轮的[誓约光辉]效果。"
    },
    {
      "name": "星之残影",
      "type": "active",
      "summary": "造成近战攻击力60%的斩击伤害。并根据攻击命中的敌人数量，为[连结的主君]效果持有者赋予[星光帷幕]效果：1轮内赋予基础生命值100%+[誓约光辉]层数110%的护盾效果。"
    },
    {
      "name": "星之帷幕",
      "type": "passive",
      "summary": "每个单位的回合结束后将周围9m的敌人拉向自身方向。"
    },
    {
      "name": "铭刻的星之轨迹",
      "type": "active",
      "summary": "造成魔法攻击力10%的无形伤害。持有的每层[誓约光辉]，造成魔法攻击力10.5%的追加无形伤害。之后根据持有的[誓约光辉]层数，为[连结的主君]效果持有者赋予相等的[魔力连结]层数：[连结的主君]效果持有者的回合开始时，消耗[魔力连结]的所有层数，并获得相当于层数40%的行动力。"
    }
  ],
  "skill_prio": [
    "被动不需要点，大招点了不加行动力回复，只需要点护盾的等级即可，养成成本极低，好评。不过有宾果任务可以低成本点一下大招。",
    "誓约一击: 不加",
    "主从连结: 不加",
    "星之残影: 6级即可",
    "星之帷幕: 不加",
    "铭刻的星之轨迹: 6级即可"
  ],
  "stigmata": {
    "set_id": null,
    "set_name": "小丑面具",
    "pieces": 4,
    "notes": [
      "2件: 战斗中魔法攻击力",
      "4件: 战斗技能伤害、魔法攻击力",
      "双胞胎姐妹的机制常态锁定ap，因此堆任何ap相关的词条都无用。堆HP收益也不高，不如用和妹妹一样的魔攻小丑多蹭点伤害。"
    ]
  },
  "weapon": "埃雷乌缇亚",
  "teams": {},
  "sources": [
    "https://www.gamekee.com/hw/707349.html"
  ],
  "stub": false,
  "as_of": "2026-09-28",
  "gamekee_content_id": 707349,
  "gamekee_entry_id": 216978,
  "portrait": "https://cdnimg-v2.gamekee.com/wiki2.0/pro/50448/images/w_1000/h_1300/50448/157597/2026/5/4/1780552745160_1780551336443_twyotcnb7t_kpaigepd68.png",
  "portrait_source": "https://www.gamekee.com/v1/entry/list?page_no=1&limit=2000",
  "portrait_via": "gamekee-entry-icon:hw:216978",
  "verified": "GameKee hw/707349 图鉴",
  "note": "抽取建议: 钦定的女王队盾位，提供常态的聚怪能力和护盾，EX0+1即可，尤其专武突破基本无价值。",
  "summary": {
    "sources": [
      "https://www.gamekee.com/hw/707349.html"
    ],
    "tier": "T1 / 坦克 / 聚怪 / 一人成军",
    "pull": "钦定的女王队盾位，提供常态的聚怪能力和护盾，EX0+1即可，尤其专武突破基本无价值。",
    "stub": false,
    "caveat": "抽取建议摘自卡面已收录备注，未另编数字。"
  }
}
