{
  "id": "ai_er_nie_si_te",
  "name": "艾尔涅斯特",
  "name_zh": "艾尔涅斯特",
  "name_en": null,
  "aliases": [],
  "nicknames": [],
  "game": "hw",
  "role": "T0.5 / 增伤 / 光环 / 一人成军",
  "skills": [
    {
      "name": "折断长枪",
      "type": "active",
      "summary": "对扇形范围内的敌人造成近战攻击力60%的斩击伤害。"
    },
    {
      "name": "自己的生命自己守护",
      "type": "passive",
      "summary": "格挡率提升20%。"
    },
    {
      "name": "阵型破坏",
      "type": "active",
      "summary": "对目标低空跃击，并对其及周围半径2.5米的圆形范围内敌人造成近战攻击力100%的斩击伤害，同时将其击退2.5米。"
    },
    {
      "name": "化危为机!",
      "type": "passive",
      "summary": "成功格挡时，立即获得1次反击机会。反击时，近战攻击力提升50%。"
    },
    {
      "name": "胜利宣言",
      "type": "active",
      "summary": "为自身及半径5公尺范围内的队友赋予持续2轮的【胜利宣言】效果：提升近战攻击力和移动力。"
    },
    {
      "name": "扰乱前线",
      "type": "active"
    }
  ],
  "skill_prio": [
    "纯加攻工具人，点一下大招就行。",
    "折断长枪: 不加",
    "自己的生命自己守护: 6级即可",
    "阵型破坏: 不加",
    "化危为机!: 不加",
    "胜利宣言: 6级即可"
  ],
  "stigmata": {
    "set_id": null,
    "set_name": "罪孽清算",
    "pieces": 4,
    "notes": [
      "2件: 战斗中行动恢复力",
      "4件: 获得行动力、敌人抗性降低",
      "纯辅助，开局比主C先动吼一嗓子就行。加攻按自己攻击力算，所以堆近战攻击力就行，也可以用开始行动力。"
    ],
    "substats_priority": [
      "近战攻击力"
    ]
  },
  "weapon": "黎明引导者",
  "teams": {},
  "sources": [
    "https://www.gamekee.com/hw/634357.html"
  ],
  "stub": false,
  "as_of": "2026-09-28",
  "gamekee_content_id": 634357,
  "gamekee_entry_id": 163031,
  "verified": "GameKee hw/634357 图鉴",
  "note": "抽取建议: 重做完成后是主C和辅助都能胜任的角色，虽然失去了拐非近战攻击角色的能力，但是换来了大量的数值反而获得了上场机会，性价比很高的角色。需要注意格挡率最高75%。",
  "summary": {
    "sources": [
      "https://www.gamekee.com/hw/634357.html"
    ],
    "tier": "T0.5 / 增伤 / 光环 / 一人成军",
    "pull": "重做完成后是主C和辅助都能胜任的角色，虽然失去了拐非近战攻击角色的能力，但是换来了大量的数值反而获得了上场机会，性价比很高的角色。需要注意格挡率最高75%。",
    "stub": false,
    "caveat": "抽取建议摘自卡面已收录备注，未另编数字。"
  }
}
