{
  "id": "pan_te_li",
  "name": "潘特莉",
  "name_zh": "潘特莉",
  "name_en": null,
  "aliases": [],
  "nicknames": [],
  "game": "hw",
  "role": "T1 / 闪避 / 单体 / 义贼王",
  "skills": [
    {
      "name": "待命",
      "type": "active",
      "summary": "指定位置待命"
    },
    {
      "name": "军刀剑击",
      "type": "active",
      "summary": "对近身的敌人施展强力而优雅的剑击，造成近战攻击力60%的斩击伤害。"
    },
    {
      "name": "坚定的心",
      "type": "passive",
      "summary": "受到攻击时，每轮仅触发1次基础反击，在反击阶段使用「感官集中」技能，提升闪避率。技能发动后，紧接著进行支援反击。"
    },
    {
      "name": "无法者的嘲讽",
      "type": "active",
      "summary": "使半径5公尺范围内的敌人的命中率在2轮内减少30%，并短暂地吸引引他们的注意力。自身获得持续2轮的【反击姿态】效果，并增加仇恨修正。"
    },
    {
      "name": "乱战大师",
      "type": "passive",
      "summary": "在自己的回合攻击时，有50%的概率使被攻击的目标误认反击对象，进而攻击自己的队友。此外，自身闪避率增加100%，即使从后方受到攻击，也不会被判定为弱点攻击。"
    },
    {
      "name": "绝对一击",
      "type": "active",
      "summary": "以剑的领悟为基础，对敌人施展无法躲避的剑击。对敌人造成近战攻击力250%的穿刺伤害。"
    }
  ],
  "skill_prio": [
    "主要点大招玩一刀流输出，然后还需要点一下受击闪避。",
    "军刀剑击: 不加",
    "坚定的心: 6级即可",
    "无法者的嘲讽: 不加",
    "乱战大师: 6级即可",
    "绝对一击: 尽量点满"
  ],
  "stigmata": {
    "set_id": null,
    "set_name": "织布机",
    "pieces": 4,
    "notes": [
      "2件: 近战攻击力+10%",
      "4件: 造成弱点攻击是斩击/穿刺/打击强化+40%。",
      "一刀流选手。副词条配合塞妈（格里泽尔达）时选择回避，没有的情况下近战攻击力收益更高。"
    ],
    "substats_priority": [
      "近战攻击力"
    ]
  },
  "weapon": "深潮之花",
  "teams": {},
  "sources": [
    "https://www.gamekee.com/hw/634419.html"
  ],
  "stub": false,
  "as_of": "2026-09-28",
  "gamekee_content_id": 634419,
  "gamekee_entry_id": 163033,
  "verified": "GameKee hw/634419 图鉴",
  "note": "抽取建议: 一刀流选手，主打配合格里泽尔达的一刀秒杀。半神化后还不错，再加上是穿刺伤害也能配合阿岚破甲和艾尔涅斯特增伤。",
  "summary": {
    "sources": [
      "https://www.gamekee.com/hw/634419.html"
    ],
    "tier": "T1 / 闪避 / 单体 / 义贼王",
    "pull": "一刀流选手，主打配合格里泽尔达的一刀秒杀。半神化后还不错，再加上是穿刺伤害也能配合阿岚破甲和艾尔涅斯特增伤。",
    "stub": false,
    "caveat": "抽取建议摘自卡面已收录备注，未另编数字。"
  }
}
