{
  "id": "mu_ying_ying",
  "name": "沐瑛英",
  "name_zh": "沐瑛英",
  "name_en": "Mu Yingying",
  "aliases": [
    "雷鸣守望者",
    "Thunderclap Guardian, Mu Yingying"
  ],
  "nicknames": [],
  "game": "hw",
  "role": "T0.5 / 全局",
  "skills": [
    {
      "name": "镇压猛击",
      "type": "active",
      "summary": "挥动镇暴棍打击敌人。对120º 2m扇形范围内的敌人造成近战攻击力60%的打击伤害。"
    },
    {
      "name": "奇袭掩护",
      "type": "passive",
      "summary": "任意回合开始时，若我方处于隐身状态，直到回合结束为止处于隐身状态的我方暴击率增加55%。从任意回合开始至结束为止，所有防御增加相当于雷电防御的110%。"
    },
    {
      "name": "电浆爆发",
      "type": "active",
      "summary": "释放强烈电击，在短时间内形成雷电区域。对半径5m范围内的敌人造成近战攻击力80%的雷电伤害。攻击成功时，赋予持续2轮的[触电]效果。达到EX+1时，攻击成功后赋予持续2轮的嘲讽效果。 -[触电]：受到攻击时，对半径5m范围内的敌人造成相当于施法者雷电防御200%的追加雷电伤害。受到雷电伤害时，效果会额外触发一次。[触电]效果造成的伤害，必须至少使用过一次「电浆爆发」技能后才会触发。达到EX+2时，追加雷电防御20%的追加雷电伤害。"
    },
    {
      "name": "迅速",
      "type": "passive",
      "summary": "若自身处于[触电]效果产生的伤害范围内，则恢复最大生命值的5%，并获得1层[电力充能]效果：近战攻击力增加20%、雷电强化增加15%、暴击率增加4%。最多可叠加10次。 达到EX+4时，[电力充能]效果的雷电强化追加增加5%。达到EX+6时，[电力充能]效果的暴击率追加增加1%。 任意回合开始时，若[电力充能]效果已叠加至10层，则移除所有[电力充能]层数，并获得[过度充电]效果：近战攻击力增加400%、雷电强化增加300%、暴击率增加80%。 达到EX+4时，[过度充电]效果的雷电强化追加增加100%。 达到EX+6时，[过度充电]效果的暴击率追加增加20%。 持有[过度充电]效果时，无法获得[电力充能]效果。"
    },
    {
      "name": "电力释放",
      "type": "active",
      "summary": "将体内累积的所有电力一次释放。持有[过度充电]效果时变成可使用状态。 大幅跳跃至指定位置，对半径7m范围内的敌人造成近战攻击力600%的雷电伤害。随后解除[过度充电]效果。"
    },
    {
      "name": "电力充能",
      "type": "passive",
      "summary": "处于[过度充电]状态时，攻击后会使用「雷击」技能进行追加应对。 雷击 释放四散的雷电。 对120º 7m扇形范围内的敌人造成近战攻击力120%的雷电伤害。"
    }
  ],
  "skill_prio": [
    "镇压猛击: 不加",
    "奇袭掩护: 6级即可",
    "电浆爆发: 6级即可",
    "迅速: 不加",
    "电力释放: 6级即可",
    "电力充能: 6级即可"
  ],
  "stigmata": {
    "set_name": "小丑面具",
    "pieces": 4,
    "notes": [
      "2件: 战斗中魔法攻击力",
      "4件: 战斗技能伤害、魔法攻击力",
      "圣痕来源: 讨伐-危险区域4-虚妄之梦的神灵（需要通关剧情-章节3虚妄之梦的阴谋普通难度解锁）"
    ]
  },
  "weapon": "战术镇压装备 - ES01",
  "teams": {
    "comp": [
      "EX0+1即可，对群能力较强，机制存在短版，但自身数值很到位，新手开荒必抽。搭配阿岚加防御则更强。输出模式有一定局限性，吸引不住仇恨则难以触发反击，需手动调整站位。"
    ]
  },
  "sources": [
    "https://www.gamekee.com/hw/725115.html",
    "https://store.steampowered.com/news/app/3279780/view/707786527706447905"
  ],
  "stub": false,
  "note": "GameKee 图鉴 hw/725115，内容 CDN 版本 2026-10-23。称号雷鸣守望者，品质 EX，费用 7，主属性暴击伤害，武器类型钝器&盾。职业名：突击战斗特工 / 强袭护卫官 / 异常开拓者。T度单元格写 T0.5，定位单元格写全局。综合加点分析单元格是空的，不补。圣痕 2 件、4 件单元格原文没有写百分比，这里不补数字。Steam 10/22 英文维护公告的技能表把多项数值写成 N，不采用那份占位文本。英文名 Mu Yingying 和搜寻名 Thunderclap Guardian, Mu Yingying 来自同一则公告。没有日文名。",
  "as_of": "2026-10-26",
  "gamekee_content_id": 725115,
  "gamekee_entry_id": 227471,
  "portrait": "https://cdnimg-v2.gamekee.com/wiki2.0/pro/50448/images/w_1000/h_1300/157597/2026/9/22/84612662mvje3nib.png",
  "portrait_source": "https://www.gamekee.com/v1/entry/list?page_no=1&limit=2000",
  "portrait_via": "gamekee-entry-icon:hw:227471",
  "verified": "GameKee hw/725115 图鉴 + Steam 10/22 维护公告",
  "summary": {
    "tier": "T0.5",
    "position": "EX / 7费 / 全局 / 雷鸣守望者",
    "pull": "EX0+1即可，对群能力较强，机制存在短版，但自身数值很到位，新手开荒必抽。搭配阿岚加防御则更强。输出模式有一定局限性，吸引不住仇恨则难以触发反击，需手动调整站位。",
    "sources": [
      "https://www.gamekee.com/hw/725115.html",
      "https://store.steampowered.com/news/app/3279780/view/707786527706447905"
    ]
  }
}
