{
  "id": "bei_er_jia",
  "name": "贝尔嘉",
  "name_zh": "贝尔嘉",
  "name_en": null,
  "aliases": [],
  "nicknames": [],
  "game": "hw",
  "role": "T1.5 / 输出 / 普攻 / 赫斯卡尔复仇者",
  "skills": [
    {
      "name": "剖开皮肉",
      "type": "active",
      "summary": "挥动托尔图拉斯，对敌人造成近战攻击力100%的斩击伤害。"
    },
    {
      "name": "巨人跃击",
      "type": "active",
      "summary": "消耗自身以外每位友军各12%的行动力发动此技能，使用技能后，自身的当前生命值将减少12%。飞扑敌人并进行强力下击。对被命中的敌人造成相当于近战攻击力150%的打击伤害。"
    },
    {
      "name": "适应筋",
      "type": "passive",
      "summary": "攻击时，若当前生命值高于50%，暴击伤害则会增加44%。受到攻击时，若当前生命值低于20%，所有防御会依照暴击伤害的数值等比例增加。"
    },
    {
      "name": "刀刃风暴",
      "type": "active",
      "summary": "向前冲刺，对路径上的所有敌人造成相当于近战攻击力90%的斩击伤害。"
    },
    {
      "name": "愤怒与粉碎的誓约",
      "type": "passive",
      "summary": "当友军受击时，将获得1层【内心的激情】效果。当【内心的激情】效果叠至最大时，将解除【眩晕】效果，并以「积压的愤怒」进行追加应对。"
    }
  ],
  "skill_prio": [
    "和输出有关的只有普攻和大招的被动，因此只需要点这两个，其他都是功能技能。",
    "剖开皮肉: 6级即可",
    "巨人跃击: 不加",
    "适应筋: 不加",
    "刀刃风暴: 不加",
    "愤怒与粉碎的誓约: 6级即可"
  ],
  "stigmata": null,
  "weapon": "赤霜托尔图拉斯",
  "teams": {},
  "sources": [
    "https://www.gamekee.com/hw/655878.html"
  ],
  "stub": false,
  "as_of": "2026-09-28",
  "gamekee_content_id": 655878,
  "gamekee_entry_id": 181898,
  "portrait": "https://cdnimg-v2.gamekee.com/wiki2.0/images/w_1000/h_1300/50448/725147/2025/8/17/896761.png",
  "portrait_source": "https://www.gamekee.com/v1/entry/list?page_no=1&limit=2000",
  "portrait_via": "gamekee-entry-icon:hw:181898",
  "verified": "GameKee hw/655878 图鉴",
  "note": "抽取建议: 中规中矩的近战C，能进行多动但是本身输出有限，基本上是配合冰女玩。EX0+1专即可。可能算马特罗索上位，不过意义不大。总体只是能用水平，不强。",
  "summary": {
    "sources": [
      "https://www.gamekee.com/hw/655878.html"
    ],
    "tier": "T1.5 / 输出 / 普攻 / 赫斯卡尔复仇者",
    "pull": "中规中矩的近战C，能进行多动但是本身输出有限，基本上是配合冰女玩。EX0+1专即可。可能算马特罗索上位，不过意义不大。总体只是能用水平，不强。",
    "stub": false,
    "caveat": "抽取建议摘自卡面已收录备注，未另编数字。"
  }
}
