{
  "id": "ka_lin_na",
  "name": "卡琳娜",
  "name_zh": "卡琳娜",
  "name_en": null,
  "aliases": [],
  "nicknames": [],
  "game": "hw",
  "role": "T1 / 输出 / 根性 / 沼泽暴君",
  "skills": [
    {
      "name": "弯刀砍击",
      "type": "active",
      "summary": "造成近战攻击力60%的斩击伤害"
    },
    {
      "name": "洞窟上的猎人",
      "type": "passive",
      "summary": "移动力上升20，攻击时，根据移动的直线距离按比例增加近战攻击力，最大10m时达到60%。"
    },
    {
      "name": "强袭",
      "type": "active",
      "summary": "跳跃至指定位置对半径1.3m圆形范围的敌人们造成近战攻击力100%的斩击伤害，无视攻击目标的反击"
    },
    {
      "name": "暴政之刃",
      "type": "active",
      "summary": "对半径2.5m圆形范围的敌人们造成近战攻击力200%的斩击伤害。使用此技能时会暂时使自己的暴击率增加相当于基础回避的12.8%，最多以此效果增加32%暴击率。"
    },
    {
      "name": "生存专家",
      "type": "passive",
      "summary": "每场战斗1次，以hp为1生存下来，立即获得105行动力。之后，自身生命值恢复12%。"
    }
  ],
  "skill_prio": [
    "大招是最高爆发，重做后大招cd减少1回合，而且专武每轮能刷1次cd，重要性直线提高，主点大招就行。",
    "弯刀砍击: 6级即可",
    "洞窟上的猎人: 6级即可",
    "强袭: 6级即可",
    "暴政之刃: 尽量点满",
    "生存专家: 6级即可"
  ],
  "stigmata": {
    "set_id": null,
    "set_name": "织布机",
    "pieces": 4,
    "notes": [
      "2件: 近战攻击力",
      "4件: 造成弱点攻击时物理伤害强化",
      "织布机套的背刺加成最适合配合她的暴君之刃打爆发。副词条主要选择暴击率，回避需要堆到250，剩下选择暴击伤害和近战攻击力。"
    ],
    "substats_priority": [
      "近战攻击力"
    ]
  },
  "weapon": "暴君之刃",
  "teams": {},
  "sources": [
    "https://www.gamekee.com/hw/634255.html"
  ],
  "stub": false,
  "as_of": "2026-09",
  "gamekee_content_id": 634255,
  "gamekee_entry_id": 163025,
  "verified": "GameKee hw/634255 图鉴"
}
