{
  "id": "ai_mi_li_ya",
  "name": "艾米莉亚",
  "name_zh": "艾米莉亚",
  "name_en": null,
  "aliases": [],
  "nicknames": [],
  "game": "hw",
  "role": "T0.5 / 增伤 / 治疗 / 一人成军",
  "skills": [
    {
      "name": "守护之击",
      "type": "active",
      "summary": "挥动战锤攻击敌人，造成相当于近战攻击力60%的打击伤害，并使行动力减少5。"
    },
    {
      "name": "治愈恩典",
      "type": "active",
      "summary": "为指定友军恢复相当于魔法攻击力100%的生命值。"
    },
    {
      "name": "神圣处方协议",
      "type": "active",
      "summary": "对指定位置周围半径2m圆形范围内除自身以外的全体我方，恢复相当于魔法攻击力11%的生命值，并对可应用现代医学的我方随机赋予持续2轮的【输液处方】、【药水处方】或【锭剂处方】效果。"
    },
    {
      "name": "野战医疗室",
      "type": "passive",
      "summary": "战斗开始时，依距离由近至远，为我方赋予1/2/3/4号【诊疗等待号码】效果。诊疗等待号码越前面的我方，获得自身赋予能力值增加的效果将会提升。"
    },
    {
      "name": "最优先奇迹处方",
      "type": "active",
      "summary": "当除自身以外的指定我方已有任意诊疗等待号码时，将对其赋予持续2轮的【最优先诊疗】效果，并将其相同地视为诊疗等待号码为1的我方。随后，对该指定我方赋予持续2轮的【奇迹处方】效果：消耗当前生命值的一部分，所有攻击力将增加。"
    },
    {
      "name": "溢流的恩宠",
      "type": "passive",
      "summary": "使用「最优先奇迹处方」技能时，对成为目标的我方，以相等于自身暴击率的发动机率赋予目标持续2轮的【神圣过量服用】效果：消耗25%当前生命值，战斗技能伤害减少，普通攻击伤害增加"
    },
    {
      "name": "刺激反应检测",
      "type": "active",
      "summary": "对友军进行物理治疗。对指定的目标造成【少量】固定伤害，赋予基础近战攻击力14%的行动力，最多提升14点行动力。使用技能后，以相当于暴击率的发动机率触发【该不会下手太重了吧】效果：目标会以施法者暴击率每20%获得1点的比例追加获得行动力，最多7点。"
    }
  ],
  "skill_prio": [
    "核心技能为野战医疗室，可以百分比提升buff的效果，因此最为重要。“仅能指定可应用现代医学的我方为目标”是指*mauve:不能奶机器人这种设定上无法“医疗”的单位*。最后的溢流的恩宠升级会降低更多的技能伤害，不建议点。",
    "守护之击: 不加",
    "治愈恩典: 不加",
    "神圣处方协议: 6级即可",
    "野战医疗室: 尽量点满",
    "最优先奇迹处方: 6级即可",
    "溢流的恩宠: 不加"
  ],
  "stigmata": {
    "set_id": null,
    "set_name": "罪孽清算",
    "pieces": 4,
    "notes": [
      "2件: 战斗中行动恢复力",
      "4件: 获得行动力、敌人抗性降低",
      "测试后建议返璞归真选择罪孽清算，放弃暴击率，堆魔攻和开始行动力，确保足够的行动力先手上buff。"
    ]
  },
  "weapon": "赛里欧尔:医疗锤",
  "teams": {
    "comp": [
      "在半神化队伍中，辅助位的Cost较为充足，而拐力饱满的艾米莉亚几乎已经成为常驻辅助，可谓恩情还不完"
    ]
  },
  "sources": [
    "https://www.gamekee.com/hw/684718.html",
    "https://www.gamekee.com/hw/665170.html"
  ],
  "stub": false,
  "as_of": "2026-09-28",
  "gamekee_content_id": 684718,
  "gamekee_entry_id": 199260,
  "portrait": "https://cdnimg-v2.gamekee.com/wiki2.0/images/w_1000/h_1300/50448/157597/2025/11/4/802228.png",
  "portrait_source": "https://www.gamekee.com/v1/entry/list?page_no=1&limit=2000",
  "portrait_via": "gamekee-entry-icon:hw:199260",
  "verified": "GameKee hw/684718 图鉴",
  "note": "抽取建议: 推荐EX0+1专武，泛用角色很容易入队。有能力优先建议抽角色突破。开服至今唯一的泛用增伤辅助，能均等的拐除了机器人外的任何输出角色，也能提供大量的行动恢复力，不过需要注意站位。除了本身极度脆皮外没什么缺点。",
  "summary": {
    "sources": [
      "https://www.gamekee.com/hw/684718.html"
    ],
    "tier": "T0.5 / 增伤 / 治疗 / 一人成军",
    "pull": "推荐EX0+1专武，泛用角色很容易入队。有能力优先建议抽角色突破。开服至今唯一的泛用增伤辅助，能均等的拐除了机器人外的任何输出角色，也能提供大量的行动恢复力，不过需要注意站位。除了本身极度脆皮外没什么缺点。",
    "stub": false,
    "caveat": "抽取建议摘自卡面已收录备注，未另编数字。"
  }
}
